{
  "extractor_version": "1.0.0",
  "project_count": 5,
  "projects": [
    {
      "project_id": "PROJECT-001",
      "valves": [
        {
          "legacy": {
            "algorithm_rating": 4,
            "has_specification": true,
            "image_count": 4,
            "metrics": {
              "Average Error": 7.88,
              "Average Hysteresis + Dead Band": 13.2,
              "Max Friction": null,
              "Maximum Hysteresis + Dead Band": 13.24,
              "Mean Friction": null,
              "Overshoot": 100.0,
              "Response Time Close": null,
              "Response Time Open": null,
              "Supply Pressure": {
                "avg": 61.9725,
                "max": 62.46,
                "min": 60.92
              },
              "T63": 2.92,
              "T86": 0.58,
              "Td": 0.3,
              "step_count": 32,
              "test_types": [
                "SIG-POS",
                "STEP"
              ]
            },
            "rating": 4
          },
          "shared": {
            "algorithm_rating": 4,
            "has_specification": true,
            "image_count": 4,
            "metrics": {
              "Average Error": 7.88,
              "Average Hysteresis + Dead Band": 13.2,
              "Max Friction": null,
              "Maximum Hysteresis + Dead Band": 13.24,
              "Mean Friction": null,
              "Overshoot": 100.0,
              "Response Time Close": null,
              "Response Time Open": null,
              "Supply Pressure": {
                "avg": 61.9725,
                "max": 62.46,
                "min": 60.92
              },
              "T63": 2.92,
              "T86": 0.58,
              "Td": 0.3,
              "step_count": 32,
              "test_types": [
                "SIG-POS",
                "STEP"
              ]
            },
            "rating": 4
          },
          "valve_id": "VALVE-001"
        },
        {
          "legacy": {
            "algorithm_rating": 4,
            "has_specification": true,
            "image_count": 4,
            "metrics": {
              "Average Error": 6.76,
              "Average Hysteresis + Dead Band": 7.67,
              "Max Friction": null,
              "Maximum Hysteresis + Dead Band": 9.19,
              "Mean Friction": null,
              "Overshoot": 100.0,
              "Response Time Close": null,
              "Response Time Open": null,
              "Supply Pressure": {
                "avg": null,
                "max": null,
                "min": null
              },
              "T63": 3.41,
              "T86": 4.0,
              "Td": 0.4,
              "step_count": 32,
              "test_types": [
                "SIG-POS",
                "STEP"
              ]
            },
            "rating": 4
          },
          "shared": {
            "algorithm_rating": 4,
            "has_specification": true,
            "image_count": 4,
            "metrics": {
              "Average Error": 6.76,
              "Average Hysteresis + Dead Band": 7.67,
              "Max Friction": null,
              "Maximum Hysteresis + Dead Band": 9.19,
              "Mean Friction": null,
              "Overshoot": 100.0,
              "Response Time Close": null,
              "Response Time Open": null,
              "Supply Pressure": {
                "avg": null,
                "max": null,
                "min": null
              },
              "T63": 3.41,
              "T86": 4.0,
              "Td": 0.4,
              "step_count": 32,
              "test_types": [
                "SIG-POS",
                "STEP"
              ]
            },
            "rating": 4
          },
          "valve_id": "VALVE-002"
        },
        {
          "legacy": {
            "algorithm_rating": 3,
            "has_specification": true,
            "image_count": 4,
            "metrics": {
              "Average Error": 2.71,
              "Average Hysteresis + Dead Band": 3.21,
              "Max Friction": null,
              "Maximum Hysteresis + Dead Band": 3.21,
              "Mean Friction": null,
              "Overshoot": 100.0,
              "Response Time Close": null,
              "Response Time Open": null,
              "Supply Pressure": {
                "avg": 50.6575,
                "max": 51.09,
                "min": 50.0
              },
              "T63": 3.59,
              "T86": 2.62,
              "Td": 0.9,
              "step_count": 32,
              "test_types": [
                "SIG-POS",
                "STEP"
              ]
            },
            "rating": 3
          },
          "shared": {
            "algorithm_rating": 3,
            "has_specification": true,
            "image_count": 4,
            "metrics": {
              "Average Error": 2.71,
              "Average Hysteresis + Dead Band": 3.21,
              "Max Friction": null,
              "Maximum Hysteresis + Dead Band": 3.21,
              "Mean Friction": null,
              "Overshoot": 100.0,
              "Response Time Close": null,
              "Response Time Open": null,
              "Supply Pressure": {
                "avg": 50.6575,
                "max": 51.09,
                "min": 50.0
              },
              "T63": 3.59,
              "T86": 2.62,
              "Td": 0.9,
              "step_count": 32,
              "test_types": [
                "SIG-POS",
                "STEP"
              ]
            },
            "rating": 3
          },
          "valve_id": "VALVE-003"
        },
        {
          "legacy": {
            "algorithm_rating": 4,
            "has_specification": true,
            "image_count": 3,
            "metrics": {
              "Average Error": 14.8,
              "Average Hysteresis + Dead Band": null,
              "Max Friction": null,
              "Maximum Hysteresis + Dead Band": null,
              "Mean Friction": null,
              "Overshoot": 67.71,
              "Response Time Close": null,
              "Response Time Open": null,
              "Supply Pressure": {
                "avg": null,
                "max": null,
                "min": null
              },
              "T63": 3.3,
              "T86": 3.6,
              "Td": 1.2,
              "step_count": 32,
              "test_types": [
                "SIG-POS",
                "STEP"
              ]
            },
            "rating": 4
          },
          "shared": {
            "algorithm_rating": 4,
            "has_specification": true,
            "image_count": 3,
            "metrics": {
              "Average Error": 14.8,
              "Average Hysteresis + Dead Band": null,
              "Max Friction": null,
              "Maximum Hysteresis + Dead Band": null,
              "Mean Friction": null,
              "Overshoot": 67.71,
              "Response Time Close": null,
              "Response Time Open": null,
              "Supply Pressure": {
                "avg": null,
                "max": null,
                "min": null
              },
              "T63": 3.3,
              "T86": 3.6,
              "Td": 1.2,
              "step_count": 32,
              "test_types": [
                "SIG-POS",
                "STEP"
              ]
            },
            "rating": 4
          },
          "valve_id": "VALVE-004"
        },
        {
          "legacy": {
            "algorithm_rating": 3,
            "has_specification": true,
            "image_count": 4,
            "metrics": {
              "Average Error": 6.49,
              "Average Hysteresis + Dead Band": 2.95,
              "Max Friction": null,
              "Maximum Hysteresis + Dead Band": 4.08,
              "Mean Friction": null,
              "Overshoot": 265.86,
              "Response Time Close": null,
              "Response Time Open": null,
              "Supply Pressure": {
                "avg": null,
                "max": null,
                "min": null
              },
              "T63": 3.76,
              "T86": 4.0,
              "Td": 2.0,
              "step_count": 32,
              "test_types": [
                "SIG-POS",
                "STEP"
              ]
            },
            "rating": 3
          },
          "shared": {
            "algorithm_rating": 3,
            "has_specification": true,
            "image_count": 4,
            "metrics": {
              "Average Error": 6.49,
              "Average Hysteresis + Dead Band": 2.95,
              "Max Friction": null,
              "Maximum Hysteresis + Dead Band": 4.08,
              "Mean Friction": null,
              "Overshoot": 265.86,
              "Response Time Close": null,
              "Response Time Open": null,
              "Supply Pressure": {
                "avg": null,
                "max": null,
                "min": null
              },
              "T63": 3.76,
              "T86": 4.0,
              "Td": 2.0,
              "step_count": 32,
              "test_types": [
                "SIG-POS",
                "STEP"
              ]
            },
            "rating": 3
          },
          "valve_id": "VALVE-005"
        },
        {
          "legacy": {
            "algorithm_rating": 3,
            "has_specification": true,
            "image_count": 4,
            "metrics": {
              "Average Error": 6.3,
              "Average Hysteresis + Dead Band": 7.07,
              "Max Friction": null,
              "Maximum Hysteresis + Dead Band": 7.67,
              "Mean Friction": null,
              "Overshoot": 100.0,
              "Response Time Close": null,
              "Response Time Open": null,
              "Supply Pressure": {
                "avg": null,
                "max": null,
                "min": null
              },
              "T63": 3.85,
              "T86": 3.76,
              "Td": 0.5,